{
  "schemaVersion": 1,
  "snapshotId": "22222222-2222-4222-8222-222222222222",
  "vaultId": "33333333-3333-4333-8333-333333333333",
  "createdAt": "2026-09-13T12:01:00.000Z",
  "expenses": [
    {
      "id": "11111111-1111-4111-8111-111111111111",
      "merchant": "Café Toronto ☕",
      "amountMinor": 1234,
      "currencyCode": "CAD",
      "expenseDate": "2024-02-29",
      "category": "Meals and entertainment",
      "note": "Team lunch\nReceipt reviewed locally.",
      "createdAt": "2026-09-13T12:00:00.000Z",
      "updatedAt": "2026-09-13T12:00:00.000Z"
    }
  ],
  "attachments": []
}
